{
  "schema_version": "2.0.0",
  "locale": "en-US",
  "decks": [
    {
      "price_model": {
        "kind": "fixed",
        "amount": 8025
      },
      "availability": "retail",
      "catalog_scope": "standard",
      "id": "kirama_lpd_12",
      "name": "Kirama LPD-12",
      "description": "Premium cellular deck advertised with expanded memory and high speed.",
      "price": 8025,
      "price_qualifier": "exact",
      "cpu": null,
      "memory": 20,
      "speed": 3,
      "data_wall": null,
      "portable": true,
      "cellular": true,
      "armor_sp": null,
      "options": [
        "cellular_link"
      ],
      "unspecified": [
        "cpu",
        "data_wall"
      ],
      "source": {
        "book": "Cyberpunk 2020 Core Rulebook",
        "pages": "148"
      }
    },
    {
      "price_model": {
        "kind": "fixed",
        "amount": 4260
      },
      "availability": "retail",
      "catalog_scope": "standard",
      "id": "sgi_elysia",
      "name": "SGI Technologies “Elysia”",
      "description": "A fully portable high-performance deck with expanded memory and eight-trode input.",
      "price": 4260,
      "price_qualifier": "exact",
      "cpu": 1,
      "memory": 20,
      "speed": 3,
      "data_wall": 5,
      "portable": true,
      "cellular": false,
      "armor_sp": null,
      "options": [
        "keyboard",
        "video_monitor_12m2",
        "eight_trode_input",
        "chip_reader"
      ],
      "unspecified": [],
      "source": {
        "book": "Cyberpunk 2020 Core Rulebook",
        "pages": "133"
      }
    },
    {
      "price_model": {
        "kind": "fixed",
        "amount": 3600
      },
      "availability": "retail",
      "catalog_scope": "standard",
      "id": "zetatech_parraline_5750",
      "name": "Zetatech Parraline 5750",
      "description": "A midrange deck with improved speed, Data Wall and a large video monitor.",
      "price": 3600,
      "price_qualifier": "approximate",
      "cpu": 1,
      "memory": 10,
      "speed": 2,
      "data_wall": 4,
      "portable": false,
      "cellular": false,
      "armor_sp": null,
      "options": [
        "keyboard",
        "video_monitor_6m2",
        "chip_reader"
      ],
      "unspecified": [],
      "source": {
        "book": "Cyberpunk 2020 Core Rulebook",
        "pages": "133"
      }
    },
    {
      "id": "dantech_cacciaguida",
      "name": "Dantech Cacciaguida",
      "description": "Italian designer deck with a large video board, chip reader and voice box.",
      "price": 7000,
      "price_model": {
        "kind": "fixed",
        "amount": 7000
      },
      "price_qualifier": "exact",
      "cpu": null,
      "memory": 10,
      "speed": 0,
      "data_wall": 5,
      "portable": false,
      "cellular": false,
      "armor_sp": null,
      "options": [
        "video_monitor_1m_x_2m",
        "chip_reader",
        "voice_box"
      ],
      "availability": "retail",
      "catalog_scope": "standard",
      "unspecified": [
        "cpu"
      ],
      "source": {
        "book": "Rache Bartmoss' Brainware Blowout",
        "pages": "11"
      }
    },
    {
      "id": "ebm_pni_210",
      "name": "EBM PNI 210",
      "description": "No-frills standard deck at the baseline market specification.",
      "price": 1000,
      "price_model": {
        "kind": "fixed",
        "amount": 1000
      },
      "price_qualifier": "exact",
      "cpu": null,
      "memory": 10,
      "speed": 0,
      "data_wall": 2,
      "portable": false,
      "cellular": false,
      "armor_sp": null,
      "options": [],
      "availability": "retail",
      "catalog_scope": "standard",
      "unspecified": [
        "cpu"
      ],
      "source": {
        "book": "Rache Bartmoss' Brainware Blowout",
        "pages": "12"
      }
    },
    {
      "id": "ebm_pni_412",
      "name": "EBM PNI 412",
      "description": "Improved EBM desk deck with Speed 2, Data Wall 4 and office peripherals.",
      "price": 4200,
      "price_model": {
        "kind": "fixed",
        "amount": 4200
      },
      "price_qualifier": "exact",
      "cpu": null,
      "memory": 10,
      "speed": 2,
      "data_wall": 4,
      "portable": false,
      "cellular": false,
      "armor_sp": null,
      "options": [
        "video_monitor_2ft_x_2ft",
        "chip_reader",
        "printer"
      ],
      "availability": "retail",
      "catalog_scope": "standard",
      "unspecified": [
        "cpu"
      ],
      "source": {
        "book": "Rache Bartmoss' Brainware Blowout",
        "pages": "12"
      }
    },
    {
      "id": "green_knight",
      "name": "Green Knight",
      "description": "A heavily protected standard deck with keyboard and compact video board.",
      "price": 10000,
      "price_model": {
        "kind": "fixed",
        "amount": 10000
      },
      "price_qualifier": "exact",
      "cpu": null,
      "memory": 10,
      "speed": 0,
      "data_wall": 8,
      "portable": false,
      "cellular": false,
      "armor_sp": null,
      "options": [
        "keyboard",
        "video_monitor_1ft_x_1ft"
      ],
      "availability": "retail",
      "catalog_scope": "standard",
      "unspecified": [
        "cpu"
      ],
      "source": {
        "book": "Rache Bartmoss' Brainware Blowout",
        "pages": "13"
      }
    },
    {
      "id": "omnibus_cyberspace_explorer_one",
      "name": "Omnibus Cyberspace Explorer One",
      "description": "Cheap explorer deck with a Speed penalty, keyboard, display, gloves and goggles.",
      "price": 1300,
      "price_model": {
        "kind": "fixed",
        "amount": 1300
      },
      "price_qualifier": "exact",
      "cpu": null,
      "memory": 10,
      "speed": -1,
      "data_wall": 2,
      "portable": false,
      "cellular": false,
      "armor_sp": null,
      "options": [
        "keyboard",
        "video_monitor_1ft_x_1ft",
        "gloves_and_goggles"
      ],
      "availability": "retail",
      "catalog_scope": "standard",
      "unspecified": [
        "cpu"
      ],
      "source": {
        "book": "Rache Bartmoss' Brainware Blowout",
        "pages": "14"
      }
    },
    {
      "id": "pct_danzig",
      "name": "PCT Danzig",
      "description": "Bare-bones standard deck with a modest Data Wall.",
      "price": 500,
      "price_model": {
        "kind": "fixed",
        "amount": 500
      },
      "price_qualifier": "exact",
      "cpu": null,
      "memory": 10,
      "speed": 0,
      "data_wall": 3,
      "portable": false,
      "cellular": false,
      "armor_sp": null,
      "options": [],
      "availability": "retail",
      "catalog_scope": "standard",
      "unspecified": [
        "cpu"
      ],
      "source": {
        "book": "Rache Bartmoss' Brainware Blowout",
        "pages": "14"
      }
    },
    {
      "id": "zetatech_parraline_5700",
      "name": "Zetatech Parraline 5700",
      "description": "Entry Parraline with Speed 1, chip reader and a small display.",
      "price": 2100,
      "price_model": {
        "kind": "fixed",
        "amount": 2100
      },
      "price_qualifier": "exact",
      "cpu": null,
      "memory": 10,
      "speed": 1,
      "data_wall": 3,
      "portable": false,
      "cellular": false,
      "armor_sp": null,
      "options": [
        "chip_reader",
        "video_monitor_1ft_x_2ft"
      ],
      "availability": "retail",
      "catalog_scope": "standard",
      "unspecified": [
        "cpu"
      ],
      "source": {
        "book": "Rache Bartmoss' Brainware Blowout",
        "pages": "18"
      }
    },
    {
      "id": "zetatech_parraline_5800",
      "name": "Zetatech Parraline 5800",
      "description": "High-end Parraline with 15 MU, Speed 3, Data Wall 6 and full office peripherals.",
      "price": 6500,
      "price_model": {
        "kind": "fixed",
        "amount": 6500
      },
      "price_qualifier": "exact",
      "cpu": null,
      "memory": 15,
      "speed": 3,
      "data_wall": 6,
      "portable": false,
      "cellular": false,
      "armor_sp": null,
      "options": [
        "keyboard",
        "chip_reader",
        "scanner",
        "video_monitor_4ft_x_4ft",
        "printer",
        "voice_box"
      ],
      "availability": "retail",
      "catalog_scope": "standard",
      "unspecified": [
        "cpu"
      ],
      "source": {
        "book": "Rache Bartmoss' Brainware Blowout",
        "pages": "18"
      }
    },
    {
      "id": "zetatech_virocana",
      "name": "Zetatech Virocana",
      "description": "A 20 MU desk fortress with Data Wall 8 and a complete peripheral suite.",
      "price": 10000,
      "price_model": {
        "kind": "fixed",
        "amount": 10000
      },
      "price_qualifier": "exact",
      "cpu": null,
      "memory": 20,
      "speed": 1,
      "data_wall": 8,
      "portable": false,
      "cellular": false,
      "armor_sp": null,
      "options": [
        "keyboard",
        "chip_reader",
        "scanner",
        "printer",
        "deck_security_system",
        "voice_box",
        "video_monitor_4ft_x_4ft"
      ],
      "availability": "retail",
      "catalog_scope": "standard",
      "unspecified": [
        "cpu"
      ],
      "source": {
        "book": "Rache Bartmoss' Brainware Blowout",
        "pages": "18"
      }
    },
    {
      "id": "aztec_600_assault_programmer",
      "name": "Aztec 600 Assault Programmer",
      "description": "Surplus combat deck with 25 MU, SP 20, hardened circuitry and broad security options.",
      "price": 8200,
      "price_model": {
        "kind": "fixed",
        "amount": 8200
      },
      "price_qualifier": "exact",
      "cpu": null,
      "memory": 25,
      "speed": 2,
      "data_wall": 5,
      "portable": true,
      "cellular": false,
      "armor_sp": 20,
      "options": [
        "keyboard",
        "video_monitor_4ft_x_4ft",
        "chip_reader",
        "netrunner_flip_switch",